[
  {
    "match_id": "fifa_world_cup:2026:fdorg:537327",
    "fixture": {
      "status": "available",
      "confidence": "high",
      "source": "football_data_org"
    },
    "result": {
      "status": "available",
      "confidence": "medium",
      "source": "worldcup_2026_local"
    },
    "events": {
      "status": "missing",
      "confidence": "low"
    },
    "lineups": {
      "status": "missing",
      "confidence": "low"
    },
    "match_stats": {
      "status": "missing",
      "confidence": "low"
    },
    "odds": {
      "status": "missing",
      "confidence": "low",
      "bookmaker_count": 0,
      "has_sharp": false
    },
    "injuries": {
      "status": "missing",
      "confidence": "low"
    },
    "weather": {
      "status": "missing",
      "confidence": "low"
    },
    "prediction": {
      "status": "available",
      "confidence": "medium",
      "source": "xgboost"
    },
    "last_checked_at": "2026-05-15T00:00:00Z"
  },
  {
    "match_id": "fifa_world_cup:2026:fdorg:537328",
    "fixture": {
      "status": "available",
      "confidence": "high",
      "source": "football_data_org"
    },
    "result": {
      "status": "available",
      "confidence": "medium",
      "source": "worldcup_2026_local"
    },
    "events": {
      "status": "missing",
      "confidence": "low"
    },
    "lineups": {
      "status": "missing",
      "confidence": "low"
    },
    "match_stats": {
      "status": "missing",
      "confidence": "low"
    },
    "odds": {
      "status": "missing",
      "confidence": "low",
      "bookmaker_count": 0,
      "has_sharp": false
    },
    "injuries": {
      "status": "missing",
      "confidence": "low"
    },
    "weather": {
      "status": "missing",
      "confidence": "low"
    },
    "prediction": {
      "status": "available",
      "confidence": "medium",
      "source": "xgboost"
    },
    "last_checked_at": "2026-05-15T00:00:00Z"
  },
  {
    "match_id": "fifa_world_cup:2026:fdorg:537329",
    "fixture": {
      "status": "available",
      "confidence": "high",
      "source": "football_data_org"
    },
    "result": {
      "status": "available",
      "confidence": "medium",
      "source": "worldcup_2026_local"
    },
    "events": {
      "status": "missing",
      "confidence": "low"
    },
    "lineups": {
      "status": "missing",
      "confidence": "low"
    },
    "match_stats": {
      "status": "missing",
      "confidence": "low"
    },
    "odds": {
      "status": "missing",
      "confidence": "low",
      "bookmaker_count": 0,
      "has_sharp": false
    },
    "injuries": {
      "status": "missing",
      "confidence": "low"
    },
    "weather": {
      "status": "missing",
      "confidence": "low"
    },
    "prediction": {
      "status": "available",
      "confidence": "medium",
      "source": "xgboost"
    },
    "last_checked_at": "2026-05-15T00:00:00Z"
  },
  {
    "match_id": "fifa_world_cup:2026:fdorg:537330",
    "fixture": {
      "status": "available",
      "confidence": "high",
      "source": "football_data_org"
    },
    "result": {
      "status": "available",
      "confidence": "medium",
      "source": "worldcup_2026_local"
    },
    "events": {
      "status": "missing",
      "confidence": "low"
    },
    "lineups": {
      "status": "missing",
      "confidence": "low"
    },
    "match_stats": {
      "status": "missing",
      "confidence": "low"
    },
    "odds": {
      "status": "missing",
      "confidence": "low",
      "bookmaker_count": 0,
      "has_sharp": false
    },
    "injuries": {
      "status": "missing",
      "confidence": "low"
    },
    "weather": {
      "status": "missing",
      "confidence": "low"
    },
    "prediction": {
      "status": "available",
      "confidence": "medium",
      "source": "xgboost"
    },
    "last_checked_at": "2026-05-15T00:00:00Z"
  },
  {
    "match_id": "fifa_world_cup:2026:fdorg:537331",
    "fixture": {
      "status": "available",
      "confidence": "high",
      "source": "football_data_org"
    },
    "result": {
      "status": "available",
      "confidence": "medium",
      "source": "worldcup_2026_local"
    },
    "events": {
      "status": "missing",
      "confidence": "low"
    },
    "lineups": {
      "status": "missing",
      "confidence": "low"
    },
    "match_stats": {
      "status": "missing",
      "confidence": "low"
    },
    "odds": {
      "status": "missing",
      "confidence": "low",
      "bookmaker_count": 0,
      "has_sharp": false
    },
    "injuries": {
      "status": "missing",
      "confidence": "low"
    },
    "weather": {
      "status": "missing",
      "confidence": "low"
    },
    "prediction": {
      "status": "available",
      "confidence": "medium",
      "source": "xgboost"
    },
    "last_checked_at": "2026-05-15T00:00:00Z"
  },
  {
    "match_id": "fifa_world_cup:2026:fdorg:537332",
    "fixture": {
      "status": "available",
      "confidence": "high",
      "source": "football_data_org"
    },
    "result": {
      "status": "available",
      "confidence": "medium",
      "source": "worldcup_2026_local"
    },
    "events": {
      "status": "missing",
      "confidence": "low"
    },
    "lineups": {
      "status": "missing",
      "confidence": "low"
    },
    "match_stats": {
      "status": "missing",
      "confidence": "low"
    },
    "odds": {
      "status": "missing",
      "confidence": "low",
      "bookmaker_count": 0,
      "has_sharp": false
    },
    "injuries": {
      "status": "missing",
      "confidence": "low"
    },
    "weather": {
      "status": "missing",
      "confidence": "low"
    },
    "prediction": {
      "status": "available",
      "confidence": "medium",
      "source": "xgboost"
    },
    "last_checked_at": "2026-05-15T00:00:00Z"
  },
  {
    "match_id": "fifa_world_cup:2026:fdorg:537333",
    "fixture": {
      "status": "available",
      "confidence": "high",
      "source": "football_data_org"
    },
    "result": {
      "status": "available",
      "confidence": "medium",
      "source": "worldcup_2026_local"
    },
    "events": {
      "status": "missing",
      "confidence": "low"
    },
    "lineups": {
      "status": "missing",
      "confidence": "low"
    },
    "match_stats": {
      "status": "missing",
      "confidence": "low"
    },
    "odds": {
      "status": "missing",
      "confidence": "low",
      "bookmaker_count": 0,
      "has_sharp": false
    },
    "injuries": {
      "status": "missing",
      "confidence": "low"
    },
    "weather": {
      "status": "missing",
      "confidence": "low"
    },
    "prediction": {
      "status": "available",
      "confidence": "medium",
      "source": "xgboost"
    },
    "last_checked_at": "2026-05-15T00:00:00Z"
  },
  {
    "match_id": "fifa_world_cup:2026:fdorg:537334",
    "fixture": {
      "status": "available",
      "confidence": "high",
      "source": "football_data_org"
    },
    "result": {
      "status": "available",
      "confidence": "medium",
      "source": "worldcup_2026_local"
    },
    "events": {
      "status": "missing",
      "confidence": "low"
    },
    "lineups": {
      "status": "missing",
      "confidence": "low"
    },
    "match_stats": {
      "status": "missing",
      "confidence": "low"
    },
    "odds": {
      "status": "missing",
      "confidence": "low",
      "bookmaker_count": 0,
      "has_sharp": false
    },
    "injuries": {
      "status": "missing",
      "confidence": "low"
    },
    "weather": {
      "status": "missing",
      "confidence": "low"
    },
    "prediction": {
      "status": "available",
      "confidence": "medium",
      "source": "xgboost"
    },
    "last_checked_at": "2026-05-15T00:00:00Z"
  },
  {
    "match_id": "fifa_world_cup:2026:fdorg:537335",
    "fixture": {
      "status": "available",
      "confidence": "high",
      "source": "football_data_org"
    },
    "result": {
      "status": "available",
      "confidence": "medium",
      "source": "worldcup_2026_local"
    },
    "events": {
      "status": "missing",
      "confidence": "low"
    },
    "lineups": {
      "status": "missing",
      "confidence": "low"
    },
    "match_stats": {
      "status": "missing",
      "confidence": "low"
    },
    "odds": {
      "status": "missing",
      "confidence": "low",
      "bookmaker_count": 0,
      "has_sharp": false
    },
    "injuries": {
      "status": "missing",
      "confidence": "low"
    },
    "weather": {
      "status": "missing",
      "confidence": "low"
    },
    "prediction": {
      "status": "available",
      "confidence": "medium",
      "source": "xgboost"
    },
    "last_checked_at": "2026-05-15T00:00:00Z"
  },
  {
    "match_id": "fifa_world_cup:2026:fdorg:537336",
    "fixture": {
      "status": "available",
      "confidence": "high",
      "source": "football_data_org"
    },
    "result": {
      "status": "available",
      "confidence": "medium",
      "source": "worldcup_2026_local"
    },
    "events": {
      "status": "missing",
      "confidence": "low"
    },
    "lineups": {
      "status": "missing",
      "confidence": "low"
    },
    "match_stats": {
      "status": "missing",
      "confidence": "low"
    },
    "odds": {
      "status": "missing",
      "confidence": "low",
      "bookmaker_count": 0,
      "has_sharp": false
    },
    "injuries": {
      "status": "missing",
      "confidence": "low"
    },
    "weather": {
      "status": "missing",
      "confidence": "low"
    },
    "prediction": {
      "status": "available",
      "confidence": "medium",
      "source": "xgboost"
    },
    "last_checked_at": "2026-05-15T00:00:00Z"
  },
  {
    "match_id": "fifa_world_cup:2026:fdorg:537337",
    "fixture": {
      "status": "available",
      "confidence": "high",
      "source": "football_data_org"
    },
    "result": {
      "status": "available",
      "confidence": "medium",